{
  "$schema": "../../schemas/trust-management.json",
  "Name": "List of Trusted Entities (LoTE)",
  "Standardization (Body, Process)": "ETSi",
  "Specification": "https://www.etsi.org/deliver/etsi_ts/119600_119699/119602/01.01.01_60/ts_119602v010101p.pdf",
  "Description": "Generic data model for lists of trusted entities, made for the EUDI Wallet ecosystem: Wallet Providers, PID Providers, access and registration certificate providers"
}
