{
  "$schema": "../../schemas/Trust-Management.json",
  "Name": "Trusted Lists",
  "Standardization (Body, Process)": "ETSi",
  "Specification": "https://www.etsi.org/deliver/etsi_ts/119600_119699/119612/02.02.01_60/ts_119612v020201p.pdf",
  "Description": "used by EU Trusted List (https://webgate.ec.europa.eu/tl-browser/)"
}
