{
  "$schema": "../../schemas/trust-management.json",
  "Name": "List of Trusted Lists (LoTL)",
  "Standardization (Body, Process)": "ETSi",
  "Specification": "https://www.etsi.org/deliver/etsi_ts/119600_119699/119612/02.02.01_60/ts_119612v020201p.pdf",
  "Description": "XML format for trusted lists, used for the national eIDAS trusted lists and the EU List of Trusted Lists (LOTL)"
}
